No,Kode,Nama Perusahaan,Tanggal Pencatatan,Saham,Papan Pencatatan
726,SAFE,Steady Safe Tbk,15 Agt 1994,615.145.012,Pemantauan Khusus
727,SAGE,Saptausaha Gemilangindah Tbk.,08 Mar 2023,8.033.261.701,Pengembangan
728,SAME,Sarana Meditama Metropolitan T,11 Jan 2013,17.138.382.545,Utama
729,SAMF,Saraswanti Anugerah Makmur Tbk,31 Mar 2020,5.125.000.000,Utama
730,SAPX,Satria Antaran Prima Tbk.,03 Okt 2018,833.333.300,Pengembangan
731,SATU,Kota Satu Properti Tbk.,05 Nov 2018,1.375.000.000,Pengembangan
732,SBAT,Sejahtera Bintang Abadi Textil,08 Apr 2020,4.752.982.378,Pemantauan Khusus
733,SBMA,Surya Biru Murni Acetylene Tbk,08 Sep 2021,929.926.282,Pengembangan
734,SCCO,Supreme Cable Manufacturing & ,20 Jul 1982,205.583.400,Utama
735,SCMA,Surya Citra Media Tbk.,16 Jul 2002,73.970.569.505,Utama
736,SCNP,Selaras Citra Nusantara Perkas,07 Sep 2020,2.500.000.000,Pengembangan
737,SCPI,Organon Pharma Indonesia Tbk.,08 Jun 1990,3.600.000,Pemantauan Khusus
738,SDMU,Sidomulyo Selaras Tbk.,12 Jul 2011,1.135.225.000,Pemantauan Khusus
739,SDPC,Millennium Pharmacon Internati,07 Mei 1990,1.274.000.000,Utama
740,SDRA,Bank Woori Saudara Indonesia 1,15 Des 2006,8.482.552.020,Utama
741,SEMA,Semacom Integrated Tbk.,10 Jan 2022,1.347.258.842,Pengembangan
742,SFAN,Surya Fajar Capital Tbk.,19 Jun 2019,1.359.934.021,Pengembangan
743,SGER,Sumber Global Energy Tbk.,10 Agt 2020,4.364.335.706,Pengembangan
744,SGRO,Sampoerna Agro Tbk.,18 Jun 2007,1.818.622.000,Utama
745,SHID,Hotel Sahid Jaya International,08 Mei 1990,1.119.326.168,Pengembangan
746,SHIP,Sillo Maritime Perdana Tbk.,16 Jun 2016,2.719.790.000,Utama
747,SICO,Sigma Energy Compressindo Tbk.,08 Apr 2022,910.048.004,Pengembangan
748,SIDO,Industri Jamu dan Farmasi Sido,18 Des 2013,30.000.000.000,Utama
749,SILO,Siloam International Hospitals,12 Sep 2013,13.006.125.000,Utama
750,SIMA,Siwani Makmur Tbk,03 Jun 1994,442.589.871,Pemantauan Khusus
751,SIMP,Salim Ivomas Pratama Tbk.,09 Jun 2011,15.816.310.000,Utama
752,SINI,Singaraja Putra Tbk.,08 Nov 2019,481.000.000,Pemantauan Khusus
753,SIPD,Sreeya Sewu Indonesia Tbk.,27 Des 1996,1.839.102.056,Pengembangan
754,SKBM,Sekar Bumi Tbk.,28 Sep 2012,1.730.103.217,Pengembangan
755,SKLT,Sekar Laut Tbk.,08 Sep 1993,6.907.405.000,Pengembangan
756,SKRN,Superkrane Mitra Utama Tbk.,11 Okt 2018,7.500.000.000,PENGEMBANGAN
757,SKYB,Northcliff Citranusa Indonesia,07 Jul 2010,585.000.000,Pemantauan Khusus
758,SLIS,Gaya Abadi Sempurna Tbk.,07 Okt 2019,2.463.335.050,Pengembangan
759,SMAR,Smart Tbk.,20 Nov 1992,2.872.193.366,Pengembangan
760,SMBR,Semen Baturaja Tbk.,28 Jun 2013,9.932.534.336,Utama
761,SMCB,Solusi Bangun Indonesia Tbk.,10 Agt 1977,9.019.381.973,Utama
762,SMDM,Suryamas Dutamakmur Tbk.,12 Okt 1995,4.772.138.237,Pengembangan
763,SMDR,Samudera Indonesia  Tbk.,05 Jul 1999,16.375.600.000,Utama
764,SMGR,Semen Indonesia (Persero) Tbk.,08 Jul 1991,6.751.540.089,Utama
765,SMIL,Sarana Mitra Luas Tbk.,12 Mei 2023,8.750.020.418,Utama
766,SMKL,Satyamitra Kemas Lestari Tbk.,11 Jul 2019,3.418.085.290,Utama
767,SMKM,Sumber Mas Konstruksi Tbk.,09 Mar 2022,1.253.000.000,Akselerasi
768,SMLE,Sinergi Multi Lestarindo Tbk.,10 Jan 2024,2.328.125.000,Pengembangan
769,SMMA,Sinarmas Multiartha Tbk.,05 Jul 1995,6.367.664.717,Utama
770,SMMT,Golden Eagle Energy Tbk.,01 Des 1997,3.150.000.000,Utama
771,SMRA,Summarecon Agung Tbk.,07 Mei 1990,16.508.568.358,Utama
772,SMRU,SMR Utama Tbk.,10 Okt 2011,12.499.385.782,Pemantauan Khusus
773,SMSM,Selamat Sempurna Tbk.,09 Sep 1996,5.758.675.440,Utama
774,SNLK,Sunter Lakeside Hotel Tbk.,29 Mar 2021,450.000.000,Pengembangan
775,SOCI,Soechi Lines Tbk.,03 Des 2014,7.059.000.000,Utama
776,SOFA,Boston Furniture Industries Tb,07 Jul 2020,1.653.574.499,Akselerasi
777,SOHO,Soho Global Health Tbk.,08 Sep 2020,12.691.682.390,Pemantauan Khusus
778,SONA,Sona Topas Tourism Industry Tb,21 Jul 1992,662.400.000,Utama
779,SOSS,Shield On Service Tbk.,06 Nov 2018,799.414.231,Pengembangan
780,SOTS,Satria Mega Kencana Tbk.,10 Des 2018,1.000.003.979,Pemantauan Khusus
781,SOUL,Mitra Tirta Buwana Tbk.,06 Jan 2023,1.082.523.811,Akselerasi
782,SPMA,Suparma Tbk.,16 Nov 1994,3.154.092.216,UTAMA
783,SPTO,Surya Pertiwi Tbk.,14 Mei 2018,2.700.000.000,Utama
784,SQMI,Wilton Makmur Indonesia Tbk.,15 Jul 2004,15.537.591.429,Pengembangan
785,SRAJ,Sejahteraraya Anugrahjaya Tbk.,11 Apr 2011,12.000.705.445,Utama
786,SRIL,Sri Rejeki Isman Tbk.,17 Jun 2013,20.452.176.844,Pemantauan Khusus
787,SRSN,Indo Acidatama Tbk,11 Jan 1993,6.020.000.000,Utama
788,SRTG,Saratoga Investama Sedaya Tbk.,26 Jun 2013,13.564.835.000,Utama
789,SSIA,Surya Semesta Internusa Tbk.,27 Mar 1997,4.705.249.440,Utama
790,SSMS,Sawit Sumbermas Sarana Tbk.,12 Des 2013,9.525.000.000,Utama
791,SSTM,Sunson Textile Manufacture Tbk,20 Agt 1997,1.170.909.181,Pemantauan Khusus
792,STAA,Sumber Tani Agung Resources Tb,10 Mar 2022,10.903.372.600,Utama
793,STAR,Buana Artha Anugerah Tbk.,13 Jul 2011,4.800.000.602,Utama
794,STRK,Lovina Beach Brewery Tbk.,10 Okt 2023,10.721.709.000,Pengembangan
795,STTP,Siantar Top Tbk.,16 Des 1996,1.310.000.000,Pengembangan
796,SUGI,Sugih Energy Tbk.,19 Jun 2002,24.811.541.414,Pemantauan Khusus
797,SULI,SLJ Global Tbk.,21 Mar 1994,4.076.916.802,Utama
798,SUNI,Sunindo Pratama Tbk.,09 Jan 2023,2.500.000.000,Utama
799,SUPR,Solusi Tunas Pratama Tbk.,11 Okt 2011,1.137.579.698,Pemantauan Khusus
800,SURE,Super Energy Tbk.,05 Okt 2018,1.497.576.771,Pemantauan Khusus
801,SURI,Maja Agung Latexindo Tbk.,07 Des 2023,6.334.375.000,Pengembangan
802,SWAT,Sriwahana Adityakarta Tbk.,08 Jun 2018,3.019.200.000,Pengembangan
803,SWID,Saraswanti Indoland Developmen,07 Jul 2022,5.385.019.201,Pengembangan
804,TALF,Tunas Alfin Tbk.,17 Jan 2014,1.353.435.000,Pengembangan
805,TAMA,Lancartama Sejati Tbk.,10 Feb 2020,1.200.000.696,Pemantauan Khusus
806,TAMU,Pelayaran Tamarin Samudra Tbk.,10 Mei 2017,37.500.000.000,Pemantauan Khusus
807,TAPG,Triputra Agro Persada Tbk.,12 Apr 2021,19.852.540.000,Utama
808,TARA,Agung Semesta Sejahtera Tbk.,11 Jul 2014,10.069.645.750,Pemantauan Khusus
809,TAXI,Express Transindo Utama Tbk.,02 Nov 2012,10.223.647.156,Pemantauan Khusus
810,TAYS,Jaya Swarasa Agung Tbk.,06 Des 2021,1.098.920.000,Pengembangan
811,TBIG,Tower Bersama Infrastructure T,26 Okt 2010,22.656.999.445,Utama
812,TBLA,Tunas Baru Lampung Tbk.,14 Feb 2000,6.025.373.372,Utama
813,TBMS,Tembaga Mulia Semanan Tbk.,23 Mei 1990,367.340.000,Pengembangan
814,TCID,Mandom Indonesia Tbk.,30 Sep 1993,402.133.334,Utama
815,TCPI,Transcoal Pacific Tbk.,06 Jul 2018,5.000.000.000,Pengembangan
816,TDPM,Tridomain Performance Material,09 Apr 2018,10.485.050.500,Pemantauan Khusus
817,TEBE,Dana Brata Luhur Tbk.,18 Nov 2019,1.285.000.000,Utama
818,TECH,Indosterling Technomedia Tbk.,04 Jun 2020,1.256.300.000,Pengembangan
819,TELE,Omni Inovasi Indonesia Tbk.,12 Jan 2012,7.310.929.389,Pemantauan Khusus
820,TFAS,Telefast Indonesia Tbk.,17 Sep 2019,1.666.666.500,Pengembangan
821,TFCO,Tifico Fiber Indonesia Tbk.,26 Feb 1980,4.823.076.400,Pemantauan Khusus
822,TGKA,Tigaraksa Satria Tbk.,11 Jun 1990,918.492.750,Pengembangan
823,TGRA,Terregra Asia Energy Tbk.,16 Mei 2017,2.750.000.000,Pemantauan Khusus
824,TGUK,Platinum Wahab Nusantara Tbk.,10 Jul 2023,3.571.433.642,Pengembangan
825,TIFA,KDB Tifa Finance Tbk.,08 Jul 2011,3.552.213.000,Pemantauan Khusus
826,TINS,Timah Tbk.,19 Okt 1995,7.447.753.454,Utama
827,TIRA,Tira Austenite Tbk,27 Jul 1993,588.000.000,Pemantauan Khusus
828,TIRT,Tirta Mahakam Resources Tbk,13 Des 1999,1.011.774.750,Pemantauan Khusus
829,TKIM,Pabrik Kertas Tjiwi Kimia Tbk.,03 Apr 1990,3.113.223.570,Utama
830,TLDN,Teladan Prima Agro Tbk.,12 Apr 2022,12.946.530.200,Utama
831,TLKM,Telkom Indonesia (Persero) Tbk,14 Nov 1995,99.062.216.600,Utama
832,TMAS,Temas Tbk.,09 Jul 2003,57.051.500.000,Utama
833,TMPO,Tempo Intimedia Tbk.,08 Jan 2001,1.058.333.250,Pengembangan
834,TNCA,Trimuda Nuansa Citra Tbk.,28 Jun 2018,421.640.000,Pengembangan
835,TOBA,TBS Energi Utama Tbk.,06 Jul 2012,8.106.700.622,Utama
836,TOOL,Rohartindo Nusantara Luas Tbk.,09 Agt 2022,2.050.014.813,Pengembangan
837,TOPS,Totalindo Eka Persada Tbk.,16 Jun 2017,33.330.000.000,Pemantauan Khusus
838,TOTL,Total Bangun Persada Tbk.,25 Jul 2006,3.410.000.000,Utama
839,TOTO,Surya Toto Indonesia Tbk.,30 Okt 1990,10.320.000.000,Pengembangan
840,TOWR,Sarana Menara Nusantara Tbk.,08 Mar 2010,51.014.625.000,Utama
841,TOYS,Sunindo Adipersada Tbk.,06 Agt 2020,1.435.000.712,Pengembangan
842,TPIA,Chandra Asri Petrochemical Tbk,26 Mei 2008,86.511.545.092,Pengembangan
843,TPMA,Trans Power Marine Tbk.,20 Feb 2013,2.633.300.000,Pengembangan
844,TRAM,Trada Alam Minera Tbk.,10 Sep 2008,49.643.627.934,Pemantauan Khusus
845,TRGU,Cerestar Indonesia Tbk.,08 Jul 2022,7.945.412.700,Pengembangan
846,TRIL,Triwira Insanlestari Tbk.,28 Jan 2008,1.200.000.000,Pemantauan Khusus
847,TRIM,Trimegah Sekuritas Indonesia T,31 Jan 2000,7.109.300.000,Utama
848,TRIN,Perintis Triniti Properti Tbk.,15 Jan 2020,4.551.457.320,Utama
849,TRIO,Trikomsel Oke Tbk.,14 Apr 2009,26.007.494.645,Pemantauan Khusus
850,TRIS,Trisula International Tbk.,28 Jun 2012,3.141.443.831,Pengembangan
851,TRJA,Transkon Jaya Tbk.,27 Agt 2020,1.510.200.000,Utama
852,TRON,Teknologi Karya Digital Nusa T,08 Mar 2023,2.950.535.952,Pengembangan
853,TRST,Trias Sentosa Tbk.,02 Jul 1990,2.808.000.000,Utama
854,TRUE,Triniti Dinamik Tbk.,10 Jun 2021,7.570.892.157,Pemantauan Khusus
855,TRUK,Guna Timur Raya Tbk.,23 Mei 2018,435.000.000,Pengembangan
856,TRUS,Trust Finance Indonesia Tbk,28 Nov 2002,800.000.000,PENGEMBANGAN
857,TSPC,Tempo Scan Pacific Tbk.,17 Jun 1994,4.509.864.300,Utama
858,TUGU,Asuransi Tugu Pratama Indonesi,28 Mei 2018,3.555.575.600,Utama
859,TYRE,King Tire Indonesia Tbk.,08 Mei 2023,3.478.031.424,Pengembangan
860,UANG,Pakuan Tbk.,06 Jul 2020,1.210.000.000,Pengembangan
861,UCID,Uni-Charm Indonesia Tbk.,20 Des 2019,4.156.572.300,Utama
862,UDNG,Agro Bahari Nusantara Tbk.,31 Okt 2023,1.750.000.000,Akselerasi
863,UFOE,Damai Sejahtera Abadi Tbk.,01 Feb 2021,2.287.500.000,Pengembangan
864,ULTJ,Ultrajaya Milk Industry & Trad,02 Jul 1990,11.553.528.000,Utama
865,UNIC,Unggul Indah Cahaya Tbk.,06 Nov 1989,383.331.363,Utama
866,UNIQ,Ulima Nitra Tbk.,08 Mar 2021,3.138.983.000,Utama
867,UNIT,Nusantara Inti Corpora Tbk,18 Apr 2002,75.422.200,Pemantauan Khusus
868,UNSP,Bakrie Sumatera Plantations Tb,06 Mar 1990,2.500.162.344,Pemantauan Khusus
869,UNTR,United Tractors Tbk.,19 Sep 1989,3.730.135.136,Utama
870,UNVR,Unilever Indonesia Tbk.,11 Jan 1982,38.150.000.000,Utama
871,URBN,Urban Jakarta Propertindo Tbk.,10 Des 2018,3.232.122.640,Pengembangan
872,UVCR,Trimegah Karya Pratama Tbk.,27 Jul 2021,2.000.144.838,Pengembangan
873,VAST,Vastland Indonesia Tbk.,08 Feb 2023,3.055.708.250,Pengembangan
874,VICI,Victoria Care Indonesia Tbk.,17 Des 2020,6.708.000.000,Utama
875,VICO,Victoria Investama Tbk.,08 Jul 2013,15.217.075.658,Pengembangan
876,VINS,Victoria Insurance Tbk.,28 Sep 2015,1.460.573.616,Pengembangan
877,VIVA,Visi Media Asia Tbk.,21 Nov 2011,16.464.270.400,Pemantauan Khusus
878,VKTR,VKTR Teknologi Mobilitas Tbk.,19 Jun 2023,43.750.000.000,Pengembangan
879,VOKS,Voksel Electric Tbk.,20 Des 1990,4.155.602.595,Utama
880,VRNA,Mizuho Leasing Indonesia Tbk.,25 Jun 2008,5.687.353.997,Pengembangan
881,VTNY,Venteny Fortuna International ,15 Des 2022,6.265.193.445,Pengembangan
882,WAPO,Wahana Pronatural Tbk.,22 Jun 2001,1.240.923.111,Pengembangan
883,WEGE,Wijaya Karya Bangunan Gedung T,30 Nov 2017,9.572.000.000,Utama
884,WEHA,WEHA Transportasi Indonesia Tb,31 Mei 2007,1.460.554.819,Utama
885,WGSH,Wira Global Solusi Tbk.,06 Des 2021,1.042.500.000,Akselerasi
886,WICO,Wicaksana Overseas Internation,08 Agt 1994,2.393.710.348,Pemantauan Khusus
887,WIDI,Widiant Jaya Krenindo Tbk.,10 Jul 2023,1.600.002.020,Akselerasi
888,WIFI,Solusi Sinergi Digital Tbk.,30 Des 2020,2.359.355.118,Utama
889,WIIM,Wismilak Inti Makmur Tbk.,18 Des 2012,2.099.873.760,Utama
890,WIKA,Wijaya Karya (Persero) Tbk.,29 Okt 2007,8.969.951.372,Utama
891,WINE,Hatten Bali Tbk.,10 Jan 2023,2.710.000.000,Pengembangan
892,WINR,Winner Nusantara Jaya Tbk.,25 Apr 2022,5.235.264.727,Pemantauan Khusus
893,WINS,Wintermar Offshore Marine Tbk.,29 Nov 2010,4.364.337.057,Utama
894,WIRG,WIR ASIA Tbk.,04 Apr 2022,11.938.622.394,Pengembangan
895,WMPP,Widodo Makmur Perkasa Tbk.,06 Des 2021,29.419.000.000,Pemantauan Khusus
896,WMUU,Widodo Makmur Unggas Tbk.,02 Feb 2021,12.941.176.500,Pemantauan Khusus
897,WOMF,Wahana Ottomitra Multiartha Tb,13 Des 2004,3.481.481.480,Utama
898,WOOD,Integra Indocabinet Tbk.,21 Jun 2017,6.437.500.000,Utama
899,WOWS,Ginting Jaya Energi Tbk.,08 Nov 2019,2.475.720.000,Pemantauan Khusus
900,WSBP,Waskita Beton Precast Tbk.,20 Sep 2016,54.555.721.325,Pemantauan Khusus
901,WSKT,Waskita Karya (Persero) Tbk.,19 Des 2012,28.806.807.016,Pemantauan Khusus
902,WTON,Wijaya Karya Beton Tbk.,08 Apr 2014,8.715.466.600,Utama
903,YELO,Yelooo Integra Datanet Tbk.,29 Okt 2018,1.912.774.405,Pemantauan Khusus
904,YPAS,Yanaprima Hastapersada Tbk,05 Mar 2008,668.000.089,Pemantauan Khusus
905,YULE,Yulie Sekuritas Indonesia Tbk.,10 Des 2004,1.785.000.000,Pemantauan Khusus
906,ZATA,Bersama Zatta Jaya Tbk.,10 Nov 2022,8.496.000.000,Pemantauan Khusus
907,ZBRA,Dosni Roha Indonesia Tbk.,01 Agt 1991,2.510.706.263,Pengembangan
908,ZINC,Kapuas Prima Coal Tbk.,16 Okt 2017,25.250.000.000,Pemantauan Khusus
909,ZONE,Mega Perintis Tbk.,12 Des 2018,870.171.478,Pengembangan
910,ZYRX,Zyrexindo Mandiri Buana Tbk.,30 Mar 2021,1.333.334.556,Pengembangan
