No,Kode,Nama Perusahaan,Tanggal Pencatatan,Saham,Papan Pencatatan
363,HRME,Menteng Heritage Realty Tbk.,12 Apr 2019,5.958.750.000,Pemantauan Khusus
364,HRTA,Hartadinata Abadi Tbk.,21 Jun 2017,4.605.262.400,Utama
365,HRUM,Harum Energy Tbk.,06 Okt 2010,13.518.100.000,Utama
366,HUMI,Humpuss Maritim Internasional ,09 Agt 2023,18.046.450.000,Utama
367,IATA,MNC Energy Investments Tbk.,13 Sep 2006,25.238.245.388,Pengembangan
368,IBFN,Intan Baru Prana Tbk.,22 Des 2014,1.517.332.349,Pemantauan Khusus
369,IBOS,Indo Boga Sukses Tbk.,25 Apr 2022,8.039.808.686,Akselerasi
370,IBST,Inti Bangun Sejahtera Tbk.,31 Agt 2012,1.350.904.927,Pemantauan Khusus
371,ICBP,Indofood CBP Sukses Makmur Tbk,07 Okt 2010,11.661.908.000,Utama
372,ICON,Island Concepts Indonesia Tbk.,08 Jul 2005,1.089.750.000,Pengembangan
373,IDEA,Idea Indonesia Akademi Tbk.,09 Sep 2021,1.062.437.500,Akselerasi
374,IDPR,Indonesia Pondasi Raya Tbk.,10 Des 2015,2.003.000.000,Utama
375,IFII,Indonesia Fibreboard Industry ,10 Des 2019,9.412.000.000,Utama
376,IFSH,Ifishdeco Tbk.,05 Des 2019,2.125.000.000,Pemantauan Khusus
377,IGAR,Champion Pacific Indonesia Tbk,05 Nov 1990,972.204.500,Utama
378,IIKP,Inti Agri Resources Tbk,14 Okt 2002,33.600.000.000,Pemantauan Khusus
379,IKAI,Intikeramik Alamasri Industri ,04 Jun 1997,13.305.799.387,Pemantauan Khusus
380,IKAN,Era Mandiri Cemerlang Tbk.,12 Feb 2020,833.333.000,Pengembangan
381,IKBI,Sumi Indo Kabel Tbk.,21 Jan 1991,1.224.000.000,PENGEMBANGAN
382,IKPM,Ikapharmindo Putramas Tbk.,08 Nov 2023,1.684.662.500,Pengembangan
383,IMAS,Indomobil Sukses Internasional,15 Nov 1993,3.994.291.039,Utama
384,IMJS,Indomobil Multi Jasa Tbk.,10 Des 2013,8.654.325.000,Utama
385,IMPC,Impack Pratama Industri Tbk.,17 Des 2014,54.268.500.000,Pengembangan
386,INAF,Indofarma Tbk.,17 Apr 2001,3.099.267.500,Pemantauan Khusus
387,INAI,Indal Aluminium Industry Tbk.,05 Des 1994,633.600.000,PENGEMBANGAN
388,INCF,Indo Komoditi Korpora Tbk.,06 Sep 2016,1.438.370.465,Pemantauan Khusus
389,INCI,Intanwijaya Internasional Tbk,24 Jul 1990,207.656.617,Utama
390,INCO,Vale Indonesia Tbk.,16 Mei 1990,9.936.338.720,Utama
391,INDF,Indofood Sukses Makmur Tbk.,14 Jul 1994,8.780.426.500,Utama
392,INDO,Royalindo Investa Wijaya Tbk.,13 Jan 2020,4.382.841.253,Pengembangan
393,INDR,Indo-Rama Synthetics Tbk.,03 Agt 1990,654.351.707,Utama
394,INDS,Indospring Tbk.,10 Agt 1990,656.249.710,Utama
395,INDX,Tanah Laut Tbk,17 Mei 2001,437.913.588,Pengembangan
396,INDY,Indika Energy Tbk.,11 Jun 2008,5.210.192.000,Utama
397,INET,Sinergi Inti Andalan Prima Tbk,24 Jul 2023,7.500.000.000,Pengembangan
398,INKP,Indah Kiat Pulp & Paper Tbk.,16 Jul 1990,5.470.982.941,Utama
399,INOV,Inocycle Technology Group Tbk.,10 Jul 2019,1.808.221.900,Utama
400,INPC,Bank Artha Graha Internasional,23 Agt 1990,20.021.178.779,Utama
401,INPP,Indonesian Paradise Property T,12 Jan 2004,11.181.971.732,Pengembangan
402,INPS,Indah Prakasa Sentosa Tbk.,06 Apr 2018,650.000.000,Pengembangan
403,INRU,Toba Pulp Lestari Tbk.,18 Jun 1990,1.388.883.283,Pengembangan
404,INTA,Intraco Penta Tbk.,23 Agt 1993,3.343.935.022,Pemantauan Khusus
405,INTD,Inter Delta Tbk,18 Des 1989,591.828.000,Pengembangan
406,INTP,Indocement Tunggal Prakarsa Tb,05 Des 1989,3.681.231.699,Utama
407,IOTF,Sumber Sinergi Makmur Tbk.,06 Okt 2023,5.280.000.000,Pengembangan
408,IPAC,Era Graharealty Tbk.,30 Jun 2021,949.868.500,Akselerasi
409,IPCC,Indonesia Kendaraan Terminal T,09 Jul 2018,1.818.384.820,Utama
410,IPCM,Jasa Armada Indonesia Tbk.,22 Des 2017,5.284.811.100,Utama
411,IPOL,Indopoly Swakarsa Industry Tbk,09 Jul 2010,6.443.379.509,Utama
412,IPPE,Indo Pureco Pratama Tbk.,09 Des 2021,4.600.000.000,Pemantauan Khusus
413,IPTV,MNC Vision Networks Tbk.,08 Jul 2019,42.197.950.841,Utama
414,IRRA,Itama Ranoraya Tbk.,15 Okt 2019,1.600.000.000,Pengembangan
415,IRSX,Aviana Sinar Abadi Tbk.,07 Feb 2023,5.000.345.691,Pengembangan
416,ISAP,Isra Presisi Indonesia Tbk.,09 Des 2022,4.020.063.840,Akselerasi
417,ISAT,Indosat Tbk.,19 Okt 1994,8.062.702.740,Utama
418,ISSP,Steel Pipe Industry of Indones,22 Feb 2013,7.185.992.035,Utama
419,ITIC,Indonesian Tobacco Tbk.,04 Jul 2019,940.720.000,Pengembangan
420,ITMA,Sumber Energi Andalan Tbk.,10 Des 1990,999.053.167,Pengembangan
421,ITMG,Indo Tambangraya Megah Tbk.,18 Des 2007,1.129.925.000,Utama
422,JARR,Jhonlin Agro Raya Tbk.,04 Agt 2022,9.230.665.050,Utama
423,JAST,Jasnita Telekomindo Tbk.,16 Mei 2019,1.082.575.627,Pengembangan
424,JATI,Informasi Teknologi Indonesia ,08 Mei 2023,3.262.511.403,Pengembangan
425,JAWA,Jaya Agra Wattie Tbk.,30 Mei 2011,16.232.951.842,Utama
426,JAYA,Armada Berjaya Trans Tbk.,21 Feb 2019,798.499.394,Pengembangan
427,JECC,Jembo Cable Company Tbk.,18 Nov 1992,151.200.000,Pemantauan Khusus
428,JGLE,Graha Andrasentra Propertindo ,29 Jun 2016,22.581.909.405,Pemantauan Khusus
429,JIHD,Jakarta International Hotels &,29 Feb 1984,2.329.040.482,Pengembangan
430,JKON,Jaya Konstruksi Manggala Prata,04 Des 2007,16.308.519.860,Utama
431,JKSW,Jakarta Kyoei Steel Works Tbk.,06 Agt 1997,150.000.000,Pemantauan Khusus
432,JMAS,Asuransi Jiwa Syariah Jasa Mit,18 Des 2017,1.000.000.000,Pengembangan
433,JPFA,Japfa Comfeed Indonesia Tbk.,23 Okt 1989,11.726.575.201,Utama
434,JRPT,Jaya Real Property Tbk.,29 Jun 1994,13.750.000.000,Utama
435,JSKY,Sky Energy Indonesia Tbk.,28 Mar 2018,2.032.540.000,Pemantauan Khusus
436,JSMR,Jasa Marga (Persero) Tbk.,12 Nov 2007,7.257.871.200,Utama
437,JSPT,Jakarta Setiabudi Internasiona,12 Jan 1998,2.318.736.000,Pengembangan
438,JTPE,Jasuindo Tiga Perkasa Tbk.,16 Apr 2002,6.852.050.000,Utama
439,KAEF,Kimia Farma Tbk.,04 Jul 2001,5.566.526.267,Utama
440,KARW,ICTSI Jasa Prima Tbk.,20 Des 1994,587.152.700,Pemantauan Khusus
441,KAYU,Darmi Bersaudara Tbk.,04 Jul 2019,665.000.000,Pengembangan
442,KBAG,Karya Bersama Anugerah Tbk.,08 Apr 2020,7.150.002.603,Pemantauan Khusus
443,KBLI,KMI Wire & Cable Tbk.,06 Jul 1992,4.007.235.107,Utama
444,KBLM,Kabelindo Murni Tbk.,01 Jun 1992,1.120.000.000,PENGEMBANGAN
445,KBLV,First Media Tbk.,25 Feb 2000,1.742.167.907,Pemantauan Khusus
446,KBRI,Kertas Basuki Rachmat Indonesi,11 Jul 2008,8.687.995.734,Pemantauan Khusus
447,KDSI,Kedawung Setia Industrial Tbk.,29 Jul 1996,405.000.000,Pengembangan
448,KDTN,Puri Sentul Permai Tbk.,09 Nov 2022,1.250.017.097,Pengembangan
449,KEEN,Kencana Energi Lestari Tbk.,02 Sep 2019,3.666.312.500,Utama
450,KEJU,Mulia Boga Raya Tbk.,25 Nov 2019,1.500.000.000,Pengembangan
451,KETR,Ketrosden Triasmitra Tbk.,11 Jan 2021,2.841.262.838,Utama
452,KIAS,Keramika Indonesia Assosiasi T,08 Des 1994,14.929.100.000,Pemantauan Khusus
453,KICI,Kedaung Indah Can Tbk,28 Okt 1993,276.000.000,UTAMA
454,KIJA,Kawasan Industri Jababeka Tbk.,10 Jan 1995,20.824.888.369,Utama
455,KING,Hoffmen Cleanindo Tbk.,16 Feb 2023,2.600.005.090,Akselerasi
456,KINO,Kino Indonesia Tbk.,11 Des 2015,1.428.571.500,Utama
457,KIOS,Kioson Komersial Indonesia Tbk,05 Okt 2017,1.075.862.550,Pengembangan
458,KJEN,Krida Jaringan Nusantara Tbk.,01 Jul 2019,500.000.000,Pengembangan
459,KKES,Kusuma Kemindo Sentosa Tbk.,08 Agt 2022,1.500.000.000,Pengembangan
460,KKGI,Resource Alam Indonesia Tbk.,01 Jul 1991,5.000.000.000,Utama
461,KLAS,Pelayaran Kurnia Lautan Semest,12 Jun 2023,2.165.000.000,Pengembangan
462,KLBF,Kalbe Farma Tbk.,30 Jul 1991,46.875.122.110,Utama
463,KLIN,Klinko Karya Imaji Tbk.,09 Agt 2022,1.307.530.330,Akselerasi
464,KMDS,Kurniamitra Duta Sentosa Tbk.,07 Sep 2020,800.000.000,Pengembangan
465,KMTR,Kirana Megatara Tbk.,19 Jun 2017,8.215.366.379,Pengembangan
466,KOBX,Kobexindo Tractors Tbk.,05 Jul 2012,2.272.500.000,Utama
467,KOCI,Kokoh Exa Nusantara Tbk.,07 Okt 2023,4.415.590.000,Pengembangan
468,KOIN,Kokoh Inti Arebama Tbk,09 Apr 2008,980.843.732,Pemantauan Khusus
469,KOKA,Koka Indonesia Tbk.,11 Okt 2023,2.861.333.000,Pengembangan
470,KONI,Perdana Bangun Pusaka Tbk,22 Agt 1995,312.000.000,Pengembangan
471,KOPI,Mitra Energi Persada Tbk.,04 Mei 2015,697.266.668,Pengembangan
472,KOTA,DMS Propertindo Tbk.,09 Jul 2019,10.546.185.701,Pemantauan Khusus
473,KPAL,Steadfast Marine Tbk.,08 Jun 2018,1.069.009.400,Pemantauan Khusus
474,KPAS,Cottonindo Ariesta Tbk.,05 Okt 2018,768.043.253,Pemantauan Khusus
475,KPIG,MNC Land Tbk.,30 Mar 2000,97.557.129.263,Pengembangan
476,KRAH,Grand Kartech Tbk.,08 Nov 2013,971.190.000,Pemantauan Khusus
477,KRAS,Krakatau Steel (Persero) Tbk.,10 Nov 2010,19.346.396.900,Pengembangan
478,KREN,Quantum Clovera Investama Tbk.,28 Jun 2002,18.208.470.100,Pemantauan Khusus
479,KRYA,Bangun Karya Perkasa Jaya Tbk.,25 Jul 2022,1.663.943.474,Pengembangan
480,KUAS,Ace Oldfields Tbk.,25 Okt 2021,1.292.808.150,Pengembangan
481,LABA,Ladangbaja Murni Tbk.,10 Jun 2021,1.011.320.535,Pengembangan
482,LAJU,Jasa Berdikari Logistics Tbk.,27 Jan 2023,2.149.942.282,Pengembangan
483,LAND,Trimitra Propertindo Tbk.,23 Agt 2018,2.792.620.000,Pemantauan Khusus
484,LAPD,Leyand International Tbk.,17 Jul 2001,3.966.350.139,Pemantauan Khusus
485,LCGP,Eureka Prima Jakarta Tbk.,13 Jul 2007,5.630.000.914,Pemantauan Khusus
486,LCKM,LCK Global Kedaton Tbk.,16 Jan 2018,1.000.000.000,Pemantauan Khusus
487,LEAD,Logindo Samudramakmur Tbk.,11 Des 2013,4.049.616.328,Utama
488,LFLO,Imago Mulia Persada Tbk.,07 Apr 2021,1.307.734.937,Akselerasi
489,LIFE,MSIG Life Insurance Indonesia ,09 Jul 2019,2.100.000.000,Pemantauan Khusus
490,LINK,Link Net Tbk.,02 Jun 2014,2.863.195.484,Utama
491,LION,Lion Metal Works Tbk.,20 Agt 1993,520.160.000,Utama
492,LMAS,Limas Indonesia Makmur Tbk,28 Des 2001,787.851.525,Pemantauan Khusus
493,LMAX,Lupromax Pelumas Indonesia Tbk,09 Agt 2023,650.000.000,Akselerasi
494,LMPI,Langgeng Makmur Industri Tbk.,17 Okt 1994,1.008.517.669,PENGEMBANGAN
495,LMSH,Lionmesh Prima Tbk.,04 Jun 1990,96.000.000,Pemantauan Khusus
496,LOPI,Logisticsplus International Tb,11 Okt 2023,1.100.000.000,Akselerasi
497,LPCK,Lippo Cikarang Tbk,24 Jul 1997,2.679.600.000,Utama
498,LPGI,Lippo General Insurance Tbk.,22 Jul 1997,300.000.000,Utama
499,LPIN,Multi Prima Sejahtera Tbk,05 Feb 1990,425.000.000,Pengembangan
500,LPKR,Lippo Karawaci Tbk.,28 Jun 1996,70.898.018.369,Utama
501,LPLI,Star Pacific Tbk,23 Okt 1989,1.170.432.803,Pengembangan
502,LPPF,Matahari Department Store Tbk.,09 Okt 1989,2.260.292.880,Utama
503,LPPS,Lenox Pasifik Investama Tbk.,28 Mar 1994,2.588.250.000,Pengembangan
504,LRNA,Eka Sari Lorena Transport Tbk.,15 Apr 2014,350.000.022,PENGEMBANGAN
505,LSIP,PP London Sumatra Indonesia Tb,05 Jul 1996,6.822.863.965,Utama
506,LTLS,Lautan Luas Tbk.,21 Jul 1997,1.560.000.000,Utama
507,LUCK,Sentral Mitra Informatika Tbk.,28 Nov 2018,715.749.640,Pengembangan
508,LUCY,Lima Dua Lima Tiga Tbk.,05 Mei 2021,1.395.137.503,Akselerasi
509,MABA,Marga Abhinaya Abadi Tbk.,22 Jun 2017,15.365.229.912,Pemantauan Khusus
510,MAGP,Multi Agro Gemilang Plantation,16 Jan 2013,9.000.000.004,Pemantauan Khusus
511,MAHA,Mandiri Herindo Adiperkasa Tbk,25 Jul 2023,16.666.000.000,Utama
512,MAIN,Malindo Feedmill Tbk.,10 Feb 2006,2.238.750.000,Utama
513,MAMI,Mas Murni Indonesia Tbk,09 Feb 1994,12.299.317.590,Pemantauan Khusus
514,MANG,Manggung Polahraya Tbk.,11 Jan 2024,3.812.500.000,Akselerasi
515,MAPA,Map Aktif Adiperkasa Tbk.,05 Jul 2018,28.504.000.000,Utama
516,MAPB,MAP Boga Adiperkasa Tbk.,21 Jun 2017,2.387.922.900,Pengembangan
517,MAPI,Mitra Adiperkasa Tbk.,10 Nov 2004,16.600.000.000,Utama
518,MARI,Mahaka Radio Integra Tbk.,11 Feb 2016,5.252.644.000,Pengembangan
519,MARK,Mark Dynamics Indonesia Tbk.,12 Jul 2017,3.800.000.310,Utama
520,MASA,Multistrada Arah Sarana Tbk.,09 Jun 2005,9.182.946.945,Utama
521,MASB,Bank Multiarta Sentosa Tbk.,30 Jun 2021,1.387.737.233,Pengembangan
522,MAXI,Maxindo Karya Anugerah Tbk.,12 Jun 2023,9.610.015.420,Pengembangan
523,MAYA,Bank Mayapada Internasional Tb,29 Agt 1997,18.860.099.030,Utama
524,MBAP,Mitrabara Adiperdana Tbk.,10 Jul 2014,1.227.271.952,Pengembangan
525,MBMA,Merdeka Battery Materials Tbk.,18 Apr 2023,107.995.419.900,Pengembangan
526,MBSS,Mitrabahtera Segara Sejati Tbk,06 Apr 2011,1.750.026.639,Utama
527,MBTO,Martina Berto Tbk.,13 Jan 2011,1.070.000.000,Utama
528,MCAS,M Cash Integrasi Tbk.,01 Nov 2017,867.933.300,Utama
529,MCOL,Prima Andalan Mandiri Tbk.,07 Sep 2021,3.555.560.000,Utama
530,MCOR,Bank China Construction Bank I,03 Jul 2007,37.540.533.209,Utama
531,MDIA,Intermedia Capital Tbk.,11 Apr 2014,39.215.538.400,Pemantauan Khusus
532,MDKA,Merdeka Copper Gold Tbk.,19 Jun 2015,24.110.850.771,Utama
533,MDKI,Emdeki Utama Tbk.,25 Sep 2017,2.530.150.002,Utama
534,MDLN,Modernland Realty Tbk.,18 Jan 1993,12.533.067.322,UTAMA
535,MDRN,Modern Internasional Tbk.,16 Jul 1991,7.632.167.798,Pemantauan Khusus
536,MEDC,Medco Energi Internasional Tbk,12 Okt 1994,25.136.231.252,Utama
537,MEDS,Hetzer Medical Indonesia Tbk.,10 Agt 2022,1.562.500.000,Pengembangan
538,MEGA,Bank Mega Tbk.,17 Apr 2000,11.623.514.905,Utama
539,MENN,Menn Teknologi Indonesia Tbk.,18 Apr 2023,1.434.038.865,Akselerasi
540,MERK,Merck Tbk.,23 Jul 1981,448.000.000,Pengembangan
541,META,Nusantara Infrastructure Tbk.,18 Jul 2001,17.710.708.194,Utama
542,MFIN,Mandala Multifinance Tbk.,06 Sep 2005,2.650.000.000,Utama
543,MFMI,Multifiling Mitra Indonesia Tb,29 Des 2010,757.581.000,Pemantauan Khusus
544,MGLV,Panca Anugrah Wisesa Tbk.,08 Jun 2021,1.904.883.411,Akselerasi
545,MGNA,Magna Investama Mandiri Tbk.,08 Jul 2014,3.410.475.412,Pemantauan Khusus
546,MGRO,Mahkota Group Tbk.,12 Jul 2018,3.554.445.700,Utama
547,MICE,Multi Indocitra Tbk.,21 Des 2005,600.000.000,PENGEMBANGAN
548,MIDI,Midi Utama Indonesia Tbk.,30 Nov 2010,33.435.294.800,Pengembangan
549,MIKA,Mitra Keluarga Karyasehat Tbk.,24 Mar 2015,14.246.349.500,Utama
550,MINA,Sanurhasta Mitra Tbk.,28 Apr 2017,6.562.500.000,Pemantauan Khusus
551,MIRA,Mitra International Resources ,30 Jan 1997,3.961.452.039,Pemantauan Khusus
552,MITI,Mitra Investindo Tbk.,16 Jul 1997,3.540.735.503,Pengembangan
553,MKNT,Mitra Komunikasi Nusantara Tbk,26 Okt 2015,5.500.000.000,Pemantauan Khusus
554,MKPI,Metropolitan Kentjana Tbk.,10 Jul 2009,948.194.000,Pengembangan
555,MKTR,Menthobi Karyatama Raya Tbk.,08 Nov 2022,12.000.122.602,Pengembangan
556,MLBI,Multi Bintang Indonesia Tbk.,15 Des 1981,2.107.000.000,Utama
557,MLIA,Mulia Industrindo Tbk,17 Jan 1994,6.615.000.000,Pengembangan
558,MLPL,Multipolar Tbk.,06 Nov 1989,15.682.323.987,Utama
559,MLPT,Multipolar Technology Tbk.,08 Jul 2013,1.875.000.000,Utama
560,MMIX,Multi Medika Internasional Tbk,06 Des 2022,2.400.090.318,Pengembangan
561,MMLP,Mega Manunggal Property Tbk.,12 Jun 2015,6.889.134.608,Utama
562,MNCN,Media Nusantara Citra Tbk.,22 Jun 2007,15.049.787.710,Utama
563,MOLI,Madusari Murni Indah Tbk.,30 Agt 2018,2.724.036.581,Pengembangan
564,MORA,Mora Telematika Indonesia Tbk.,08 Agt 2022,23.646.668.691,Utama
565,MPMX,Mitra Pinasthika Mustika Tbk.,29 Mei 2013,4.462.963.276,Utama
566,MPOW,Megapower Makmur Tbk.,05 Jul 2017,816.997.053,Pengembangan
567,MPPA,Matahari Putra Prima Tbk.,21 Des 1992,12.966.640.084,Utama
568,MPRO,Maha Properti Indonesia Tbk.,09 Okt 2018,9.942.500.000,Pengembangan
569,MPXL,MPX Logistics International Tb,09 Mei 2023,2.000.004.750,Pengembangan
570,MRAT,Mustika Ratu Tbk.,27 Jul 1995,428.000.000,Utama
571,MREI,Maskapai Reasuransi Indonesia ,04 Sep 1989,517.791.681,Pengembangan
572,MSIE,Multisarana Intan Eduka Tbk.,10 Agt 2023,1.460.000.000,Akselerasi
573,MSIN,MNC Digital Entertainment Tbk.,08 Jun 2018,12.135.235.641,Utama
574,MSJA,Multi Spunindo Jaya Tbk.,10 Jan 2024,5.882.352.900,Utama
575,MSKY,MNC Sky Vision Tbk.,09 Jul 2012,1.994.370.480,Utama
576,MSTI,Mastersystem Infotama Tbk.,08 Nov 2023,3.138.823.600,Utama
577,MTDL,Metrodata Electronics Tbk.,09 Apr 1990,12.276.884.585,Utama
578,MTEL,Dayamitra Telekomunikasi Tbk.,22 Nov 2021,83.552.719.544,Utama
579,MTFN,Capitalinc Investment Tbk.,16 Apr 1990,31.842.082.852,Pemantauan Khusus
580,MTLA,Metropolitan Land Tbk.,20 Jun 2011,7.655.126.330,Utama
581,MTMH,Murni Sadar Tbk.,20 Apr 2022,2.068.526.950,Utama
582,MTPS,Meta Epsi Tbk.,10 Apr 2019,2.084.850.829,Pemantauan Khusus
583,MTRA,Mitra Pemuda Tbk.,10 Feb 2016,770.000.000,Pemantauan Khusus
584,MTSM,Metro Realty Tbk.,08 Jan 1992,232.848.000,Pengembangan
585,MTWI,Malacca Trust Wuwungan Insuran,12 Okt 2017,2.924.486.639,Pengembangan
586,MUTU,Mutuagung Lestari Tbk.,09 Agt 2023,3.142.857.200,Pengembangan
587,MYOH,Samindo Resources Tbk.,27 Jul 2000,2.206.312.500,Utama
588,MYOR,Mayora Indah Tbk.,04 Jul 1990,22.358.699.725,Utama
589,MYRX,Hanson International Tbk.,31 Okt 1990,86.703.220.792,Pemantauan Khusus
590,MYTX,Asia Pacific Investama Tbk.,10 Okt 1989,7.747.281.949,Pemantauan Khusus
591,NANO,Nanotech Indonesia Global Tbk.,10 Mar 2022,4.285.212.699,Akselerasi
592,NASA,Andalan Perkasa Abadi Tbk.,07 Agt 2017,11.004.929.322,Pemantauan Khusus
593,NASI,Wahana Inti Makmur Tbk.,13 Des 2021,807.400.000,Pengembangan
594,NATO,Surya Permata Andalan Tbk.,18 Jan 2019,8.001.111.504,Pengembangan
595,NAYZ,Hassana Boga Sejahtera Tbk.,06 Feb 2023,2.550.009.172,Akselerasi
596,NCKL,Trimegah Bangun Persada Tbk.,12 Apr 2023,63.098.600.000,Utama
597,NELY,Pelayaran Nelly Dwi Putri Tbk.,11 Okt 2012,2.350.000.000,Pengembangan
598,NETV,Net Visi Media Tbk.,26 Jan 2022,23.453.177.240,Pemantauan Khusus
599,NFCX,NFC Indonesia Tbk.,12 Jul 2018,666.667.500,Pengembangan
600,NICE,Adhi Kartiko Pratama Tbk.,09 Jan 2024,6.082.020.000,Pengembangan
601,NICK,Charnic Capital Tbk.,02 Mei 2018,651.150.000,Pengembangan
602,NICL,PAM Mineral Tbk.,09 Jul 2021,10.635.644.907,Pengembangan
603,NIKL,Pelat Timah Nusantara Tbk.,14 Des 2009,2.523.350.000,Utama
604,NINE,Techno9 Indonesia Tbk.,05 Des 2022,2.157.000.000,Akselerasi
605,NIPS,Nipress Tbk.,24 Jul 1991,1.635.333.332,Pemantauan Khusus
606,NIRO,City Retail Developments Tbk.,13 Sep 2012,22.198.871.804,Pengembangan
607,NISP,Bank OCBC NISP Tbk.,20 Okt 1994,22.715.776.032,Utama
608,NOBU,Bank Nationalnobu Tbk.,20 Mei 2013,7.403.659.460,Utama
609,NPGF,Nusa Palapa Gemilang Tbk.,14 Apr 2021,3.240.235.840,Utama
610,NRCA,Nusa Raya Cipta Tbk.,27 Jun 2013,2.496.258.344,Utama
611,NSSS,Nusantara Sawit Sejahtera Tbk.,10 Mar 2023,23.788.870.577,Pengembangan
612,NTBK,Nusatama Berkah Tbk.,09 Feb 2022,2.700.064.877,Pengembangan
613,NUSA,Sinergi Megah Internusa Tbk.,12 Jul 2018,7.700.000.148,Pemantauan Khusus
614,NZIA,Nusantara Almazia Tbk.,25 Sep 2019,2.197.540.705,UTAMA
615,OASA,Maharaksa Biru Energi Tbk.,18 Jul 2016,6.347.220.000,Pengembangan
616,OBMD,OBM Drilchem Tbk.,08 Des 2021,805.992.931,Pengembangan
617,OCAP,Onix Capital Tbk.,10 Okt 2003,273.200.000,Pemantauan Khusus
618,OILS,Indo Oil Perkasa Tbk.,06 Sep 2021,454.056.563,Pengembangan
619,OKAS,Ancora Indonesia Resources Tbk,29 Mar 2006,2.373.449.165,Pengembangan
620,OLIV,Oscar Mitra Sukses Sejahtera T,17 Mei 2022,1.900.073.314,Akselerasi
621,OMED,Jayamas Medica Industri Tbk.,08 Nov 2022,27.058.850.000,Utama
622,OMRE,Indonesia Prima Property Tbk,22 Agt 1994,2.945.211.000,Pengembangan
623,OPMS,Optima Prima Metal Sinergi Tbk,23 Sep 2019,1.000.000.000,Pengembangan
624,PACK,Solusi Kemasan Digital Tbk.,08 Feb 2023,1.537.549.933,Akselerasi
625,PADA,Personel Alih Daya Tbk.,08 Des 2022,3.150.000.000,Pengembangan
626,PADI,Minna Padi Investama Sekuritas,09 Jan 2012,11.307.246.524,Pemantauan Khusus
627,PALM,Provident Investasi Bersama Tb,08 Okt 2012,7.119.540.356,Pengembangan
628,PAMG,Bima Sakti Pertiwi Tbk.,05 Jul 2019,3.125.000.000,Utama
629,PANI,Pantai Indah Kapuk Dua Tbk.,18 Sep 2018,15.627.150.000,Pengembangan
630,PANR,Panorama Sentrawisata Tbk.,18 Sep 2001,1.387.500.000,Utama
631,PANS,Panin Sekuritas Tbk.,31 Mei 2000,720.000.000,Utama
632,PBID,Panca Budi Idaman Tbk.,13 Des 2017,1.875.000.000,Utama
633,PBRX,Pan Brothers Tbk.,16 Agt 1990,21.482.028.246,Pemantauan Khusus
634,PBSA,Paramita Bangun Sarana Tbk.,28 Sep 2016,3.000.000.000,Utama
635,PCAR,Prima Cakrawala Abadi Tbk.,29 Des 2017,1.166.666.700,Pengembangan
636,PDES,Destinasi Tirta Nusantara Tbk,08 Jul 2008,715.000.000,Pengembangan
637,PDPP,Primadaya Plastisindo Tbk.,09 Nov 2022,3.061.341.438,Pengembangan
638,PEGE,Panca Global Kapital Tbk.,24 Jun 2005,2.833.417.056,Pengembangan
639,PEHA,Phapros Tbk.,26 Des 2018,840.000.000,Utama
640,PEVE,Penta Valent Tbk.,24 Jan 2023,1.765.625.000,Pengembangan
641,PGAS,Perusahaan Gas Negara Tbk.,15 Des 2003,24.241.508.196,Utama
642,PGEO,Pertamina Geothermal Energy Tb,24 Feb 2023,41.396.142.000,Utama
643,PGJO,Tourindo Guide Indonesia Tbk.,08 Jan 2020,765.259.095,Akselerasi
644,PGLI,Pembangunan Graha Lestari Inda,05 Apr 2000,488.000.000,Pengembangan
645,PGUN,Pradiksi Gunatama Tbk.,07 Jul 2020,5.737.848.882,Utama
646,PICO,Pelangi Indah Canindo Tbk,23 Sep 1996,568.375.000,Pengembangan
647,PIPA,Multi Makmur Lemindo Tbk.,10 Apr 2023,3.425.011.071,Pengembangan
648,PJAA,Pembangunan Jaya Ancol Tbk.,02 Jul 2004,1.599.999.996,Utama
649,PKPK,Perdana Karya Perkasa Tbk,11 Jul 2007,1.200.000.000,Pengembangan
650,PLAN,Planet Properindo Jaya Tbk.,15 Sep 2020,896.709.596,Akselerasi
651,PLAS,Polaris Investama Tbk,16 Mar 2001,1.184.200.000,Pemantauan Khusus
652,PLIN,Plaza Indonesia Realty Tbk.,15 Jun 1992,3.550.000.000,Utama
653,PMJS,Putra Mandiri Jembar Tbk.,18 Des 2019,13.755.600.000,Pengembangan
654,PMMP,Panca Mitra Multiperdana Tbk.,18 Des 2020,2.588.300.000,Utama
655,PNBN,Bank Pan Indonesia Tbk,29 Des 1982,23.837.645.998,Utama
656,PNBS,Bank Panin Dubai Syariah Tbk.,15 Jan 2014,38.425.504.906,Utama
657,PNGO,Pinago Utama Tbk.,31 Agt 2020,781.250.000,Pengembangan
658,PNIN,Paninvest Tbk.,20 Sep 1983,4.068.323.920,Utama
659,PNLF,Panin Financial Tbk.,14 Jun 1983,32.022.073.293,Utama
660,PNSE,Pudjiadi & Sons Tbk.,01 Mei 1990,797.813.496,Pemantauan Khusus
661,POLA,Pool Advista Finance Tbk.,16 Nov 2018,3.351.075.600,Pemantauan Khusus
662,POLI,Pollux Hotels Group Tbk.,10 Jan 2019,2.010.526.400,Pengembangan
663,POLL,Pollux Properties Indonesia Tb,11 Jul 2018,8.318.823.600,Pengembangan
664,POLU,Golden Flower Tbk.,26 Jun 2019,750.000.000,Pemantauan Khusus
665,POLY,Asia Pacific Fibers Tbk,12 Mar 1991,2.495.753.334,Pemantauan Khusus
666,POOL,Pool Advista Indonesia Tbk.,20 Mei 1991,2.341.366.264,Pemantauan Khusus
667,PORT,Nusantara Pelabuhan Handal Tbk,16 Mar 2017,2.813.941.985,Pengembangan
668,POSA,Bliss Properti Indonesia Tbk.,10 Mei 2019,8.388.870.206,Pemantauan Khusus
669,POWR,Cikarang Listrindo Tbk.,14 Jun 2016,16.087.156.000,Utama
670,PPGL,Prima Globalindo Logistik Tbk.,20 Jul 2020,771.178.020,Akselerasi
671,PPRE,PP Presisi Tbk.,24 Nov 2017,10.224.271.000,Utama
672,PPRI,Paperocks Indonesia Tbk.,08 Agt 2023,1.075.000.000,Pengembangan
673,PPRO,PP Properti Tbk.,19 Mei 2015,61.675.671.883,Pemantauan Khusus
674,PRAS,Prima Alloy Steel Universal Tb,12 Jul 1990,701.043.478,Utama
675,PRAY,Famon Awal Bros Sedaya Tbk.,08 Nov 2022,13.959.422.300,Pengembangan
676,PRDA,Prodia Widyahusada Tbk.,07 Des 2016,937.500.000,Utama
677,PRIM,Royal Prima Tbk.,15 Mei 2018,3.393.434.905,Pengembangan
678,PSAB,J Resources Asia Pasifik Tbk.,22 Apr 2003,26.460.000.000,Pengembangan
679,PSDN,Prasidha Aneka Niaga Tbk,18 Okt 1994,1.440.000.000,Pengembangan
680,PSGO,Palma Serasih Tbk.,25 Nov 2019,18.850.000.000,Utama
681,PSKT,Red Planet Indonesia Tbk.,19 Sep 1995,10.351.231.636,Pemantauan Khusus
682,PSSI,IMC Pelita Logistik Tbk.,05 Des 2017,5.417.063.153,Utama
683,PTBA,Bukit Asam Tbk.,23 Des 2002,11.520.659.250,Utama
684,PTDU,Djasa Ubersakti Tbk.,08 Des 2020,1.500.000.000,Pemantauan Khusus
685,PTIS,Indo Straits Tbk.,12 Jul 2011,550.165.300,Utama
686,PTMP,Mitra Pack Tbk.,06 Mar 2023,3.169.200.000,Pengembangan
687,PTPP,PP (Persero) Tbk.,09 Feb 2010,6.199.897.354,Utama
688,PTPS,Pulau Subur Tbk.,09 Okt 2023,2.167.500.000,Pengembangan
689,PTPW,Pratama Widya Tbk.,07 Feb 2020,878.187.500,Pengembangan
690,PTRO,Petrosea Tbk.,21 Mei 1990,1.008.605.000,Utama
691,PTSN,Sat Nusapersada Tbk,08 Nov 2007,5.314.344.000,Utama
692,PTSP,Pioneerindo Gourmet Internatio,30 Mei 1994,220.808.000,Pengembangan
693,PUDP,Pudjiadi Prestige Tbk.,18 Nov 1994,329.560.000,UTAMA
694,PURA,Putra Rajawali Kencana Tbk.,29 Jan 2020,6.301.930.902,Pemantauan Khusus
695,PURE,Trinitan Metals and Minerals T,09 Okt 2019,1.375.181.505,Pemantauan Khusus
696,PURI,Puri Global Sukses Tbk.,08 Sep 2020,1.000.000.000,Pengembangan
697,PWON,Pakuwon Jati Tbk.,09 Okt 1989,48.159.602.400,Utama
698,PYFA,Pyridam Farma Tbk,16 Okt 2001,535.080.000,Pengembangan
699,PZZA,Sarimelati Kencana Tbk.,23 Mei 2018,3.021.875.000,Utama
700,RAAM,Tripar Multivision Plus Tbk.,08 Mei 2023,6.194.200.000,Utama
701,RAFI,Sari Kreasi Boga Tbk.,05 Agt 2022,3.128.140.475,Pengembangan
702,RAJA,Rukun Raharja Tbk.,19 Apr 2006,4.227.082.500,Utama
703,RALS,Ramayana Lestari Sentosa Tbk.,24 Jul 1996,7.096.000.000,Utama
704,RANC,Supra Boga Lestari Tbk.,07 Jun 2012,1.564.487.500,Pengembangan
705,RBMS,Ristia Bintang Mahkotasejati T,19 Des 1997,2.656.212.826,Pemantauan Khusus
706,RCCC,Utama Radar Cahaya Tbk.,02 Agt 2022,750.000.000,Akselerasi
707,RDTX,Roda Vivatex Tbk,14 Mei 1990,268.800.000,Utama
708,REAL,Repower Asia Indonesia Tbk.,06 Des 2019,6.633.610.151,Pemantauan Khusus
709,RELF,Graha Mitra Asia Tbk.,22 Jun 2023,5.727.801.723,Akselerasi
710,RELI,Reliance Sekuritas Indonesia T,13 Jul 2005,1.800.000.000,Utama
711,RGAS,Kian Santang Muliatama Tbk.,08 Nov 2023,1.459.200.000,Pengembangan
712,RICY,Ricky Putra Globalindo Tbk,22 Jan 1998,641.717.510,Utama
713,RIGS,Rig Tenders Indonesia Tbk.,05 Mar 1990,609.130.000,Pengembangan
714,RIMO,Rimo International Lestari Tbk,10 Nov 2000,45.080.600.000,Pemantauan Khusus
715,RISE,Jaya Sukses Makmur Sentosa Tbk,09 Jul 2018,10.945.000.000,Pengembangan
716,RMKE,RMK Energy Tbk.,07 Des 2021,4.375.000.000,Utama
717,RMKO,Royaltama Mulia Kontraktorindo,31 Jul 2023,1.250.000.000,Pengembangan
718,ROCK,Rockfields Properti Indonesia ,10 Sep 2020,1.435.185.100,Pemantauan Khusus
719,RODA,Pikko Land Development Tbk.,22 Okt 2001,13.592.128.209,Pemantauan Khusus
720,RONY,Aesler Grup Internasional Tbk.,09 Apr 2020,1.250.000.000,Pengembangan
721,ROTI,Nippon Indosari Corpindo Tbk.,28 Jun 2010,6.186.488.888,Utama
722,RSCH,Charlie Hospital Semarang Tbk.,28 Agt 2023,2.650.000.000,Pengembangan
723,RSGK,Kedoya Adyaraya Tbk.,08 Sep 2021,929.675.000,Utama
724,RUIS,Radiant Utama Interinsco Tbk.,12 Jul 2006,770.000.000,Pengembangan
725,RUNS,Global Sukses Solusi Tbk.,08 Sep 2021,983.557.875,Akselerasi
