No,Kode,Nama Perusahaan,Tanggal Pencatatan,Saham,Papan Pencatatan
1,AALI,Astra Agro Lestari Tbk.,09 Des 1997,1.924.688.333,Utama
2,ABBA,Mahaka Media Tbk.,03 Apr 2002,3.935.892.857,Pemantauan Khusus
3,ABDA,Asuransi Bina Dana Arta Tbk.,06 Jul 1989,620.806.680,Pemantauan Khusus
4,ABMM,ABM Investama Tbk.,06 Des 2011,2.753.165.000,Utama
5,ACES,Ace Hardware Indonesia Tbk.,06 Nov 2007,17.150.000.000,Utama
6,ACRO,Samcro Hyosung Adilestari Tbk.,11 Jan 2024,3.469.138.591,Pengembangan
7,ACST,Acset Indonusa Tbk.,24 Jun 2013,12.675.160.000,Utama
8,ADCP,Adhi Commuter Properti Tbk.,21 Mei 2021,22.222.222.200,Utama
9,ADES,Akasha Wira International Tbk.,13 Jun 1994,589.896.800,Pengembangan
10,ADHI,Adhi Karya (Persero) Tbk.,18 Mar 2004,8.407.608.979,Utama
11,ADMF,Adira Dinamika Multi Finance T,31 Mar 2004,1.000.000.000,Utama
12,ADMG,Polychem Indonesia Tbk,20 Okt 1993,3.889.179.559,Utama
13,ADMR,Adaro Minerals Indonesia Tbk.,03 Jan 2022,40.882.331.500,Utama
14,ADRO,Adaro Energy Indonesia Tbk.,16 Jul 2008,31.985.962.000,Utama
15,AEGS,Anugerah Spareparts Sejahtera ,11 Sep 2023,1.006.000.000,Akselerasi
16,AGAR,Asia Sejahtera Mina Tbk.,02 Des 2019,1.000.000.000,Pemantauan Khusus
17,AGII,Samator Indo Gas Tbk.,28 Sep 2016,3.066.660.000,Utama
18,AGRO,Bank Raya Indonesia Tbk.,08 Agt 2003,24.493.093.216,Utama
19,AGRS,Bank IBK Indonesia Tbk.,22 Des 2014,37.365.877.065,Pengembangan
20,AHAP,Asuransi Harta Aman Pratama Tb,14 Sep 1990,4.900.000.000,Pengembangan
21,AIMS,Akbar Indo Makmur Stimec Tbk,20 Jul 2001,220.000.000,Pemantauan Khusus
22,AISA,FKS Food Sejahtera Tbk.,11 Jun 1997,9.311.800.000,Utama
23,AKKU,Anugerah Kagum Karya Utama Tbk,01 Nov 2004,6.449.463.636,Pemantauan Khusus
24,AKPI,Argha Karya Prima Industry Tbk,18 Des 1992,612.248.000,Pengembangan
25,AKRA,AKR Corporindo Tbk.,03 Okt 1994,20.073.474.600,Utama
26,AKSI,Mineral Sumberdaya Mandiri Tbk,13 Jul 2001,720.000.000,Pengembangan
27,ALDO,Alkindo Naratama Tbk.,12 Jul 2011,1.350.356.872,Pengembangan
28,ALKA,Alakasa Industrindo Tbk,12 Jul 1990,507.665.055,Pengembangan
29,ALMI,Alumindo Light Metal Industry ,02 Jan 1997,3.816.000.000,Pengembangan
30,ALTO,Tri Banyan Tirta Tbk.,10 Jul 2012,2.191.870.558,Pemantauan Khusus
31,AMAG,Asuransi Multi Artha Guna Tbk.,23 Des 2005,5.001.552.516,Pengembangan
32,AMAN,Makmur Berkah Amanda Tbk.,13 Mar 2020,3.873.500.000,Pengembangan
33,AMAR,Bank Amar Indonesia Tbk.,09 Jan 2020,18.197.283.760,Pengembangan
34,AMFG,Asahimas Flat Glass Tbk.,08 Nov 1995,434.000.000,Utama
35,AMIN,Ateliers Mecaniques D Indonesi,10 Des 2015,1.080.000.000,Pengembangan
36,AMMN,Amman Mineral Internasional Tb,07 Jul 2023,72.518.217.656,Utama
37,AMMS,Agung Menjangan Mas Tbk.,04 Agt 2022,1.200.048.831,Akselerasi
38,AMOR,Ashmore Asset Management Indon,14 Jan 2020,2.222.222.400,Pengembangan
39,AMRT,Sumber Alfaria Trijaya Tbk.,15 Jan 2009,41.524.501.700,Utama
40,ANDI,Andira Agro Tbk.,16 Agt 2018,9.350.000.000,Pemantauan Khusus
41,ANJT,Austindo Nusantara Jaya Tbk.,08 Mei 2013,3.354.175.000,Utama
42,ANTM,Aneka Tambang Tbk.,27 Nov 1997,24.030.764.725,Utama
43,APEX,Apexindo Pratama Duta Tbk.,05 Jun 2013,2.830.004.997,Utama
44,APIC,Pacific Strategic Financial Tb,18 Des 2002,11.766.313.488,Pengembangan
45,APII,Arita Prima Indonesia Tbk.,29 Okt 2013,1.075.760.000,Pengembangan
46,APLI,Asiaplast Industries Tbk.,01 Mei 2000,1.362.671.400,Utama
47,APLN,Agung Podomoro Land Tbk.,11 Nov 2010,22.699.326.779,Utama
48,ARCI,Archi Indonesia Tbk.,28 Jun 2021,24.835.000.000,Utama
49,ARGO,Argo Pantes Tbk,07 Jan 1991,3.174.339.029,Pemantauan Khusus
50,ARII,Atlas Resources Tbk.,08 Nov 2011,3.431.000.000,Pengembangan
51,ARKA,Arkha Jayanti Persada Tbk.,10 Jul 2019,2.000.000.000,Pemantauan Khusus
52,ARKO,Arkora Hydro Tbk.,08 Jul 2022,2.928.495.000,Pengembangan
53,ARMY,Armidian Karyatama Tbk.,21 Jun 2017,9.006.250.000,Pemantauan Khusus
54,ARNA,Arwana Citramulia Tbk.,17 Jul 2001,7.341.430.976,Utama
55,ARTA,Arthavest Tbk,05 Nov 2002,446.674.175,Pemantauan Khusus
56,ARTI,Ratu Prabu Energi Tbk,30 Apr 2003,7.840.000.000,Pemantauan Khusus
57,ARTO,Bank Jago Tbk.,12 Jan 2016,13.717.687.500,Utama
58,ASBI,Asuransi Bintang Tbk.,29 Nov 1989,348.386.472,Pengembangan
59,ASDM,Asuransi Dayin Mitra Tbk.,15 Des 1989,384.000.000,Utama
60,ASGR,Astra Graphia Tbk.,15 Nov 1989,1.348.780.500,Utama
61,ASHA,Cilacap Samudera Fishing Indus,27 Mei 2022,5.000.000.000,Pengembangan
62,ASII,Astra International Tbk.,04 Apr 1990,40.483.553.140,Utama
63,ASJT,Asuransi Jasa Tania Tbk.,23 Des 2003,1.400.000.000,Utama
64,ASLC,Autopedia Sukses Lestari Tbk.,25 Jan 2022,12.746.354.780,Pengembangan
65,ASLI,Asri Karya Lestari Tbk.,05 Jan 2024,6.250.000.000,Utama
66,ASMI,Asuransi Maximus Graha Persada,16 Jan 2014,8.958.380.460,Pemantauan Khusus
67,ASPI,Andalan Sakti Primaindo Tbk.,17 Feb 2020,681.823.317,Pengembangan
68,ASRI,Alam Sutera Realty Tbk.,18 Des 2007,19.649.411.888,Utama
69,ASRM,Asuransi Ramayana Tbk.,19 Mar 1990,304.283.840,Pemantauan Khusus
70,ASSA,Adi Sarana Armada Tbk.,12 Nov 2012,3.691.137.517,Utama
71,ATAP,Trimitra Prawara Goldland Tbk.,11 Des 2020,1.250.000.000,Pengembangan
72,ATIC,Anabatic Technologies Tbk.,08 Jul 2015,2.315.361.355,Utama
73,AUTO,Astra Otoparts Tbk.,15 Jun 1998,4.819.733.000,Utama
74,AVIA,Avia Avian Tbk.,08 Des 2021,61.953.555.600,Utama
75,AWAN,Era Digital Media Tbk.,18 Apr 2023,3.435.000.000,Pengembangan
76,AXIO,Tera Data Indonusa Tbk.,20 Jul 2022,5.840.126.500,Utama
77,AYAM,Janu Putra Sejahtera Tbk.,30 Nov 2023,4.000.000.000,Pengembangan
78,AYLS,Agro Yasa Lestari Tbk.,12 Feb 2020,853.423.236,Pengembangan
79,BABP,Bank MNC Internasional Tbk.,15 Jul 2002,44.014.333.126,Pengembangan
80,BABY,Multitrend Indo Tbk.,07 Sep 2023,2.668.586.400,Utama
81,BACA,Bank Capital Indonesia Tbk.,04 Okt 2007,19.753.494.636,Pengembangan
82,BAJA,Saranacentral Bajatama Tbk.,21 Des 2011,1.800.000.000,Pengembangan
83,BALI,Bali Towerindo Sentra Tbk.,13 Mar 2014,3.934.592.500,Utama
84,BANK,Bank Aladin Syariah Tbk.,01 Feb 2021,14.621.864.102,Utama
85,BAPA,Bekasi Asri Pemula Tbk.,14 Jan 2008,661.784.520,Utama
86,BAPI,Bhakti Agung Propertindo Tbk.,16 Sep 2019,5.591.980.103,Pemantauan Khusus
87,BATA,Sepatu Bata Tbk.,24 Mar 1982,1.300.000.000,Utama
88,BAUT,Mitra Angkasa Sejahtera Tbk.,28 Jan 2022,4.800.134.078,Pemantauan Khusus
89,BAYU,Bayu Buana Tbk,30 Okt 1989,353.220.780,Pengembangan
90,BBCA,Bank Central Asia Tbk.,31 Mei 2000,122.042.299.500,Utama
91,BBHI,Allo Bank Indonesia Tbk.,12 Agt 2015,21.512.953.877,Utama
92,BBKP,Bank KB Bukopin Tbk.,10 Jul 2006,185.819.884.852,Utama
93,BBLD,Buana Finance Tbk.,07 Mei 1990,1.645.796.054,Pengembangan
94,BBMD,Bank Mestika Dharma Tbk.,08 Jul 2013,4.049.189.100,Utama
95,BBNI,Bank Negara Indonesia (Persero,25 Nov 1996,36.924.339.786,Utama
96,BBRI,Bank Rakyat Indonesia (Persero,10 Nov 2003,150.043.411.587,Utama
97,BBRM,Pelayaran Nasional Bina Buana ,09 Jan 2013,8.479.490.328,Utama
98,BBSI,Krom Bank Indonesia Tbk.,07 Sep 2020,3.637.976.068,Pengembangan
99,BBSS,Bumi Benowo Sukses Sejahtera T,15 Apr 2020,4.800.016.020,Pengembangan
100,BBTN,Bank Tabungan Negara (Persero),17 Des 2009,13.894.099.969,Utama
101,BBYB,Bank Neo Commerce Tbk.,13 Jan 2015,11.918.427.523,Utama
102,BCAP,MNC Kapital Indonesia Tbk.,08 Jun 2001,42.618.850.927,Utama
103,BCIC,Bank JTrust Indonesia Tbk.,25 Jun 1997,17.926.071.041,Pengembangan
104,BCIP,Bumi Citra Permai Tbk.,11 Des 2009,1.429.915.525,Pengembangan
105,BDKR,Berdikari Pondasi Perkasa Tbk.,03 Mar 2023,4.718.012.536,Pengembangan
106,BDMN,Bank Danamon Indonesia Tbk.,06 Des 1989,9.675.817.341,Utama
107,BEBS,Berkah Beton Sadaya Tbk.,10 Mar 2021,45.000.000.000,Pengembangan
108,BEEF,Estika Tata Tiara Tbk.,10 Jan 2019,7.031.371.419,Pengembangan
109,BEER,Jobubu Jarum Minahasa Tbk.,06 Jan 2023,4.000.000.000,Pengembangan
110,BEKS,Bank Pembangunan Daerah Banten,13 Jul 2001,51.351.733.883,Pemantauan Khusus
111,BELI,Global Digital Niaga Tbk.,08 Nov 2022,120.766.180.771,Ekonomi Baru
112,BELL,Trisula Textile Industries Tbk,03 Okt 2017,7.250.000.000,Pengembangan
113,BESS,Batulicin Nusantara Maritim Tb,09 Mar 2020,3.440.455.528,Pengembangan
114,BEST,Bekasi Fajar Industrial Estate,10 Apr 2012,9.647.311.150,Utama
115,BFIN,BFI Finance  Indonesia Tbk.,16 Mei 1990,15.967.115.620,Utama
116,BGTG,Bank Ganesha Tbk.,12 Mei 2016,23.731.287.132,Pengembangan
117,BHAT,Bhakti Multi Artha Tbk.,15 Apr 2020,5.000.000.000,Pengembangan
118,BHIT,MNC Asia Holding Tbk.,24 Nov 1997,86.068.156.705,Utama
119,BIKA,Binakarya Jaya Abadi Tbk.,14 Jul 2015,592.280.000,Pemantauan Khusus
120,BIKE,Sepeda Bersama Indonesia Tbk.,21 Mar 2022,1.293.386.521,Pengembangan
121,BIMA,Primarindo Asia Infrastructure,30 Agt 1994,608.175.716,Pengembangan
122,BINA,Bank Ina Perdana Tbk.,16 Jan 2014,6.073.369.498,Utama
123,BINO,Perma Plasindo Tbk.,25 Nov 2021,2.175.019.761,Pengembangan
124,BIPI,Astrindo Nusantara Infrastrukt,11 Feb 2010,63.710.196.917,Pengembangan
125,BIPP,Bhuwanatala Indah Permai Tbk.,23 Okt 1995,5.028.669.376,Pemantauan Khusus
126,BIRD,Blue Bird Tbk.,05 Nov 2014,2.502.100.000,Utama
127,BISI,BISI International Tbk.,28 Mei 2007,3.000.000.000,Utama
128,BJBR,Bank Pembangunan Daerah Jawa B,08 Jul 2010,10.416.229.249,Utama
129,BJTM,Bank Pembangunan Daerah Jawa T,12 Jul 2012,14.865.343.101,Utama
130,BKDP,Bukit Darmo Property Tbk,15 Jun 2007,7.513.992.252,Pengembangan
131,BKSL,Sentul City Tbk.,28 Jul 1997,167.708.902.705,Pemantauan Khusus
132,BKSW,Bank QNB Indonesia Tbk.,21 Nov 2002,34.953.681.505,Pengembangan
133,BLTA,Berlian Laju Tanker Tbk,26 Mar 1990,25.940.187.103,Pemantauan Khusus
134,BLTZ,Graha Layar Prima Tbk.,10 Apr 2014,873.937.142,Pengembangan
135,BLUE,Berkah Prima Perkasa Tbk.,08 Jul 2019,418.000.000,Pengembangan
136,BMAS,Bank Maspion Indonesia Tbk.,11 Jul 2013,17.921.635.680,Pengembangan
137,BMBL,Lavender Bina Cendikia Tbk.,11 Jan 2023,1.030.080.995,Akselerasi
138,BMHS,Bundamedik Tbk.,06 Jul 2021,8.603.416.176,Utama
139,BMRI,Bank Mandiri (Persero) Tbk.,14 Jul 2003,92.399.999.996,Utama
140,BMSR,Bintang Mitra Semestaraya Tbk,29 Des 1999,1.159.200.024,Utama
141,BMTR,Global Mediacom Tbk.,17 Jul 1995,16.583.997.586,Utama
142,BNBA,Bank Bumi Arta Tbk.,01 Jun 2006,3.354.120.000,Utama
143,BNBR,Bakrie & Brothers Tbk,28 Agt 1989,160.057.457.509,Pengembangan
144,BNGA,Bank CIMB Niaga Tbk.,29 Nov 1989,24.880.290.775,Utama
145,BNII,Bank Maybank Indonesia Tbk.,21 Nov 1989,75.357.433.911,Utama
146,BNLI,Bank Permata Tbk.,15 Jan 1990,35.819.545.925,Utama
147,BOBA,Formosa Ingredient Factory Tbk,01 Nov 2021,1.155.750.000,Pengembangan
148,BOGA,Bintang Oto Global Tbk.,19 Des 2016,3.803.526.210,Pengembangan
149,BOLA,Bali Bintang Sejahtera Tbk.,17 Jun 2019,6.000.000.000,Utama
150,BOLT,Garuda Metalindo Tbk.,07 Jul 2015,2.343.750.000,Pengembangan
151,BOSS,Borneo Olah Sarana Sukses Tbk.,15 Feb 2018,1.400.000.000,Pemantauan Khusus
152,BPFI,Woori Finance Indonesia Tbk.,01 Jun 2009,2.673.995.362,Pengembangan
153,BPII,Batavia Prosperindo Internasio,08 Jul 2014,515.498.662,Pemantauan Khusus
154,BPTR,Batavia Prosperindo Trans Tbk.,09 Jul 2018,3.534.000.000,Utama
155,BRAM,Indo Kordsa Tbk.,05 Sep 1990,450.056.980,Utama
156,BREN,Barito Renewables Energy Tbk.,09 Okt 2023,133.786.220.000,Utama
157,BRIS,Bank Syariah Indonesia Tbk.,09 Mei 2018,45.667.877.639,Utama
158,BRMS,Bumi Resources Minerals Tbk.,09 Des 2010,141.784.040.338,Utama
159,BRNA,Berlina Tbk.,06 Nov 1989,979.110.000,Pengembangan
160,BRPT,Barito Pacific Tbk.,01 Okt 1993,93.747.218.044,Utama
161,BSBK,Wulandari Bangun Laksana Tbk.,08 Nov 2022,25.091.882.375,Pemantauan Khusus
162,BSDE,Bumi Serpong Damai Tbk.,06 Jun 2008,21.171.365.812,Utama
163,BSIM,Bank Sinarmas Tbk.,13 Des 2010,19.517.921.842,Utama
164,BSML,Bintang Samudera Mandiri Lines,16 Des 2021,1.850.225.000,Pengembangan
165,BSSR,Baramulti Suksessarana Tbk.,08 Nov 2012,2.616.500.000,Pengembangan
166,BSWD,Bank Of India Indonesia Tbk.,01 Mei 2002,3.651.978.177,Pemantauan Khusus
167,BTEK,Bumi Teknokultura Unggul Tbk,14 Mei 2004,46.277.496.376,Pemantauan Khusus
168,BTEL,Bakrie Telecom Tbk.,03 Feb 2006,36.822.665.755,Pemantauan Khusus
169,BTON,Betonjaya Manunggal Tbk.,18 Jul 2001,720.000.000,Pengembangan
170,BTPN,Bank BTPN Tbk.,12 Mar 2008,8.066.054.461,Utama
171,BTPS,Bank BTPN Syariah Tbk.,08 Mei 2018,7.626.663.000,Utama
172,BUAH,Segar Kumala Indonesia Tbk.,09 Agt 2022,1.000.000.000,Pengembangan
173,BUDI,Budi Starch & Sweetener Tbk.,08 Mei 1995,4.498.997.362,Utama
174,BUKA,Bukalapak.com Tbk.,06 Agt 2021,103.099.967.067,Ekonomi Baru
175,BUKK,Bukaka Teknik Utama Tbk.,29 Jun 2015,2.640.452.000,Pengembangan
176,BULL,Buana Lintas Lautan Tbk.,23 Mei 2011,14.117.801.449,Pengembangan
177,BUMI,Bumi Resources Tbk.,30 Jul 1990,371.320.705.024,Utama
178,BUVA,Bukit Uluwatu Villa Tbk.,12 Jul 2010,20.590.473.213,Pengembangan
179,BVIC,Bank Victoria International Tb,30 Jun 1999,15.690.044.329,Utama
180,BWPT,Eagle High Plantations Tbk.,27 Okt 2009,31.525.291.000,Utama
181,BYAN,Bayan Resources Tbk.,12 Agt 2008,33.333.335.000,Utama
182,CAKK,Cahayaputra Asa Keramik Tbk.,31 Okt 2018,1.203.300.219,Pengembangan
183,CAMP,Campina Ice Cream Industry Tbk,19 Des 2017,5.885.000.000,Utama
184,CANI,Capitol Nusantara Indonesia Tb,16 Jan 2014,833.440.000,Pemantauan Khusus
185,CARE,Metro Healthcare Indonesia Tbk,13 Mar 2020,33.250.000.000,Pengembangan
186,CARS,Industri dan Perdagangan Bintr,10 Apr 2017,15.000.000.000,Utama
187,CASA,Capital Financial Indonesia Tb,19 Jul 2016,54.476.269.803,Pengembangan
188,CASH,Cashlez Worldwide Indonesia Tb,04 Mei 2020,1.431.125.517,Akselerasi
189,CASS,Cardig Aero Services Tbk.,05 Des 2011,2.086.950.000,Utama
190,CBMF,Cahaya Bintang Medan Tbk.,09 Apr 2020,1.875.000.000,Pemantauan Khusus
191,CBPE,Citra Buana Prasida Tbk.,06 Jan 2023,1.356.250.000,Pengembangan
192,CBRE,Cakra Buana Resources Energi T,09 Jan 2023,4.538.033.936,Pemantauan Khusus
193,CBUT,Citra Borneo Utama Tbk.,08 Nov 2022,3.125.000.000,Utama
194,CCSI,Communication Cable Systems In,18 Jun 2019,1.199.999.998,Pengembangan
195,CEKA,Wilmar Cahaya Indonesia Tbk.,09 Jul 1996,595.000.000,Utama
196,CENT,Centratama Telekomunikasi Indo,01 Nov 2001,31.183.464.900,Pemantauan Khusus
197,CFIN,Clipan Finance Indonesia Tbk.,27 Agt 1990,3.984.520.457,Utama
198,CGAS,Citra Nusantara Gemilang Tbk.,08 Jan 2024,1.771.429.000,Pengembangan
199,CHEM,Chemstar Indonesia Tbk.,08 Jul 2022,1.700.014.594,Pengembangan
200,CHIP,Pelita Teknologi Global Tbk.,08 Feb 2023,806.000.000,Akselerasi
201,CINT,Chitose Internasional Tbk.,27 Jun 2014,1.000.000.000,PENGEMBANGAN
202,CITA,Cita Mineral Investindo Tbk.,20 Mar 2002,3.960.361.250,Pengembangan
203,CITY,Natura City Developments Tbk.,28 Sep 2018,5.405.188.966,Utama
204,CLAY,Citra Putra Realty Tbk.,18 Jan 2019,2.570.000.000,Pemantauan Khusus
205,CLEO,Sariguna Primatirta Tbk.,05 Mei 2017,12.000.000.000,Utama
206,CLPI,Colorpak Indonesia Tbk.,30 Nov 2001,306.338.500,PENGEMBANGAN
207,CMNP,Citra Marga Nusaphala Persada ,10 Jan 1995,5.436.480.208,Utama
208,CMNT,Cemindo Gemilang Tbk.,08 Sep 2021,17.125.504.000,Utama
209,CMPP,AirAsia Indonesia Tbk.,08 Des 1994,10.685.124.441,Pemantauan Khusus
210,CMRY,Cisarua Mountain Dairy Tbk.,06 Des 2021,7.934.683.000,Utama
211,CNKO,Exploitasi Energi Indonesia Tb,20 Nov 2001,8.956.361.206,Pemantauan Khusus
212,CNMA,Nusantara Sejahtera Raya Tbk.,02 Agt 2023,83.345.000.000,Utama
213,CNTX,Century Textile Industry Tbk.,22 Mei 1979,70.000.000,Pemantauan Khusus
214,COAL,Black Diamond Resources Tbk.,07 Sep 2022,6.250.000.000,Pengembangan
215,COCO,Wahana Interfood Nusantara Tbk,20 Mar 2019,889.863.981,Pengembangan
216,COWL,Cowell Development Tbk.,19 Des 2007,4.871.214.021,Pemantauan Khusus
217,CPIN,Charoen Pokphand Indonesia Tbk,18 Mar 1991,16.398.000.000,UTAMA
218,CPRI,Capri Nusa Satu Properti Tbk.,11 Apr 2019,2.433.379.958,Pemantauan Khusus
219,CPRO,Central Proteina Prima Tbk.,28 Nov 2006,59.572.382.787,Pengembangan
220,CRAB,Toba Surimi Industries Tbk.,10 Agt 2022,1.950.000.000,Pengembangan
221,CRSN,Carsurin Tbk.,10 Jul 2023,2.892.000.000,Pengembangan
222,CSAP,Catur Sentosa Adiprana Tbk.,12 Des 2007,5.683.175.151,Utama
223,CSIS,Cahayasakti Investindo Sukses ,10 Mei 2017,1.307.000.000,Pengembangan
224,CSMI,Cipta Selera Murni Tbk.,09 Apr 2020,816.061.500,Pemantauan Khusus
225,CSRA,Cisadane Sawit Raya Tbk.,09 Jan 2020,2.050.000.000,Utama
226,CTBN,Citra Tubindo Tbk.,28 Nov 1989,800.371.500,Pemantauan Khusus
227,CTRA,Ciputra Development Tbk.,28 Mar 1994,18.535.695.255,Utama
228,CTTH,Citatah Tbk.,03 Jul 1996,1.230.839.821,Pemantauan Khusus
229,CUAN,Petrindo Jaya Kreasi Tbk.,08 Mar 2023,11.241.890.000,Pemantauan Khusus
230,CYBR,ITSEC Asia Tbk.,08 Agt 2023,6.449.574.702,Pengembangan
231,DADA,Diamond Citra Propertindo Tbk.,14 Feb 2020,7.431.530.800,Pemantauan Khusus
232,DART,Duta Anggada Realty Tbk.,08 Mei 1990,3.141.390.962,Utama
233,DAYA,Duta Intidaya Tbk.,28 Jun 2016,2.420.547.025,Pengembangan
234,DCII,DCI Indonesia Tbk.,06 Jan 2021,2.383.745.900,Pengembangan
235,DEAL,Dewata Freightinternational Tb,11 Nov 2018,1.146.170.959,Pemantauan Khusus
236,DEFI,Danasupra Erapacific Tbk.,06 Jul 2001,687.266.666,Pemantauan Khusus
237,DEPO,Caturkarda Depo Bangunan Tbk.,25 Nov 2021,6.790.000.000,Utama
238,DEWA,Darma Henwa Tbk,26 Sep 2007,21.853.733.792,Utama
239,DEWI,Dewi Shri Farmindo Tbk.,18 Jul 2022,2.000.000.000,Pengembangan
240,DFAM,Dafam Property Indonesia Tbk.,27 Apr 2018,1.899.852.850,Pengembangan
241,DGIK,Nusa Konstruksi Enjiniring Tbk,19 Des 2007,5.541.165.000,Utama
242,DGNS,Diagnos Laboratorium Utama Tbk,15 Jan 2021,1.250.000.000,Pengembangan
243,DIGI,Arkadia Digital Media Tbk.,18 Sep 2018,1.625.000.000,Pemantauan Khusus
244,DILD,Intiland Development Tbk.,04 Sep 1991,10.365.854.185,Utama
245,DIVA,Distribusi Voucher Nusantara T,27 Nov 2018,1.428.571.400,Pengembangan
246,DKFT,Central Omega Resources Tbk.,21 Nov 1997,5.638.246.600,Pengembangan
247,DLTA,Delta Djakarta Tbk.,27 Feb 1984,800.659.050,Utama
248,DMAS,Puradelta Lestari Tbk.,29 Mei 2015,48.198.111.100,Utama
249,DMMX,Digital Mediatama Maxima Tbk.,21 Okt 2019,7.692.307.700,Pengembangan
250,DMND,Diamond Food Indonesia Tbk.,22 Jan 2020,9.468.359.000,Utama
251,DNAR,Bank Oke Indonesia Tbk.,11 Jul 2014,16.867.292.274,Utama
252,DNET,Indoritel Makmur Internasional,11 Des 2000,14.184.000.000,Pengembangan
253,DOID,Delta Dunia Makmur Tbk.,15 Jun 2001,8.621.173.232,Utama
254,DOOH,Era Media Sejahtera Tbk.,08 Mei 2023,7.737.552.720,Pengembangan
255,DPNS,Duta Pertiwi Nusantara Tbk.,08 Agt 1990,331.129.952,Utama
256,DPUM,Dua Putra Utama Makmur Tbk.,08 Des 2015,4.175.000.000,Pemantauan Khusus
257,DRMA,Dharma Polimetal Tbk.,20 Des 2021,4.705.882.300,Utama
258,DSFI,Dharma Samudera Fishing Indust,24 Mar 2000,1.857.135.500,Utama
259,DSNG,Dharma Satya Nusantara Tbk.,14 Jun 2013,10.599.842.400,Utama
260,DSSA,Dian Swastatika Sentosa Tbk,10 Des 2009,770.552.320,Utama
261,DUCK,Jaya Bersama Indo Tbk.,10 Okt 2018,1.283.330.000,Pemantauan Khusus
262,DUTI,Duta Pertiwi Tbk,02 Nov 1994,1.850.000.000,Pengembangan
263,DVLA,Darya-Varia Laboratoria Tbk.,11 Nov 1994,1.120.000.000,Utama
264,DWGL,Dwi Guna Laksana Tbk.,13 Des 2017,9.252.820.991,Pengembangan
265,DYAN,Dyandra Media International Tb,25 Mar 2013,4.272.964.279,Utama
266,EAST,Eastparc Hotel Tbk.,09 Jul 2019,4.126.405.336,Pengembangan
267,ECII,Electronic City Indonesia Tbk.,03 Jul 2013,1.334.333.000,Pengembangan
268,EDGE,Indointernet Tbk.,08 Feb 2021,2.020.250.000,Pengembangan
269,EKAD,Ekadharma International Tbk.,14 Agt 1990,3.493.875.000,Utama
270,ELIT,Data Sinergitama Jaya Tbk.,06 Jan 2023,2.031.643.057,Pengembangan
271,ELPI,Pelayaran Nasional Ekalya Purn,08 Agt 2022,7.412.000.000,Utama
272,ELSA,Elnusa Tbk.,06 Feb 2008,7.298.500.000,Utama
273,ELTY,Bakrieland Development Tbk.,30 Okt 1995,43.521.913.019,Pemantauan Khusus
274,EMDE,Megapolitan Developments Tbk.,12 Jan 2011,3.350.000.000,Pengembangan
275,EMTK,Elang Mahkota Teknologi Tbk.,12 Jan 2010,61.316.751.483,Utama
276,ENAK,Champ Resto Indonesia Tbk.,08 Feb 2022,2.166.666.800,Pengembangan
277,ENRG,Energi Mega Persada Tbk.,07 Jun 2004,24.821.230.250,Utama
278,ENVY,Envy Technologies Indonesia Tb,08 Jul 2019,1.800.000.000,Pemantauan Khusus
279,ENZO,Morenzo Abadi Perkasa Tbk.,14 Sep 2020,2.162.547.122,Pemantauan Khusus
280,EPAC,Megalestari Epack Sentosaraya ,01 Jul 2020,3.303.400.000,Pemantauan Khusus
281,EPMT,Enseval Putera Megatrading Tbk,01 Agt 1994,2.708.640.000,Pengembangan
282,ERAA,Erajaya Swasembada Tbk.,14 Des 2011,15.950.000.000,Utama
283,ERAL,Sinar Eka Selaras Tbk.,08 Agt 2023,5.187.500.000,Utama
284,ERTX,Eratex Djaja Tbk.,21 Agt 1990,1.286.539.792,Pengembangan
285,ESIP,Sinergi Inti Plastindo Tbk.,14 Nov 2019,1.109.953.847,Pemantauan Khusus
286,ESSA,ESSA Industries Indonesia Tbk.,01 Feb 2012,17.226.975.700,Utama
287,ESTA,Esta Multi Usaha Tbk.,09 Mar 2020,2.425.354.179,Pengembangan
288,ESTI,Ever Shine Tex Tbk.,13 Okt 1992,2.015.208.720,Pemantauan Khusus
289,ETWA,Eterindo Wahanatama Tbk,16 Mei 1997,4.668.671.400,Pemantauan Khusus
290,EURO,Estee Gold Feet Tbk.,08 Agt 2022,2.548.826.428,Akselerasi
291,EXCL,XL Axiata Tbk.,29 Sep 2005,13.128.430.665,Utama
292,FAPA,FAP Agri Tbk.,04 Jan 2021,3.629.411.800,Pengembangan
293,FAST,Fast Food Indonesia Tbk.,11 Mei 1993,3.990.277.158,Pengembangan
294,FASW,Fajar Surya Wisesa Tbk.,19 Des 1994,2.477.888.787,Pemantauan Khusus
295,FILM,MD Pictures Tbk.,07 Agt 2018,9.511.217.000,Utama
296,FIMP,Fimperkasa Utama Tbk.,09 Apr 2021,400.000.975,Akselerasi
297,FIRE,Alfa Energi Investama Tbk.,09 Jun 2017,1.475.363.179,Pengembangan
298,FISH,FKS Multi Agro Tbk.,18 Jan 2002,480.000.000,Pemantauan Khusus
299,FITT,Hotel Fitra International Tbk.,11 Jun 2019,726.130.199,Pengembangan
300,FLMC,Falmaco Nonwoven Industri Tbk.,08 Jul 2021,781.250.000,Pemantauan Khusus
301,FMII,Fortune Mate Indonesia Tbk,30 Jun 2000,6.400.000.000,Pengembangan
302,FOLK,Multi Garam Utama Tbk.,07 Agt 2023,3.948.133.300,Pengembangan
303,FOOD,Sentra Food Indonesia Tbk.,08 Jan 2019,650.000.000,Pengembangan
304,FORU,Fortune Indonesia Tbk,17 Jan 2002,465.224.000,Pengembangan
305,FORZ,Forza Land Indonesia Tbk.,28 Apr 2017,1.984.009.887,Pemantauan Khusus
306,FPNI,Lotte Chemical Titan Tbk.,21 Mar 2002,5.566.414.000,PENGEMBANGAN
307,FREN,Smartfren Telecom Tbk.,29 Nov 2006,335.388.088.377,Utama
308,FUJI,Fuji Finance Indonesia Tbk.,09 Jul 2019,1.300.000.000,PENGEMBANGAN
309,FUTR,Lini Imaji Kreasi Ekosistem Tb,27 Feb 2023,6.390.016.474,Pengembangan
310,FWCT,Wijaya Cahaya Timber Tbk.,01 Feb 2023,1.875.000.000,Pengembangan
311,GAMA,Aksara Global Development Tbk.,11 Jul 2012,10.011.027.656,Pemantauan Khusus
312,GDST,Gunawan Dianjaya Steel Tbk.,23 Des 2009,9.242.500.000,Pengembangan
313,GDYR,Goodyear Indonesia Tbk.,22 Des 1980,410.000.000,Utama
314,GEMA,Gema Grahasarana Tbk.,12 Agt 2002,1.600.000.000,Pengembangan
315,GEMS,Golden Energy Mines Tbk.,17 Nov 2011,5.882.353.000,Utama
316,GGRM,Gudang Garam Tbk.,27 Agt 1990,1.924.088.000,Utama
317,GGRP,Gunung Raja Paksi Tbk.,19 Sep 2019,12.111.376.157,Pengembangan
318,GHON,Gihon Telekomunikasi Indonesia,09 Apr 2018,550.000.000,Utama
319,GIAA,Garuda Indonesia (Persero) Tbk,11 Feb 2011,91.480.783.837,Pemantauan Khusus
320,GJTL,Gajah Tunggal Tbk.,08 Mei 1990,3.484.800.000,Utama
321,GLOB,Globe Kita Terang Tbk.,10 Jul 2012,1.111.112.000,Pemantauan Khusus
322,GLVA,Galva Technologies Tbk.,23 Des 2019,1.500.000.000,Pengembangan
323,GMFI,Garuda Maintenance Facility Ae,10 Okt 2017,28.233.511.500,Pengembangan
324,GMTD,Gowa Makassar Tourism Developm,11 Des 2000,1.015.380.000,Pemantauan Khusus
325,GOLD,Visi Telekomunikasi Infrastruk,07 Jul 2010,1.277.276.000,Pengembangan
326,GOLL,Golden Plantation Tbk.,23 Des 2014,3.665.000.759,Pemantauan Khusus
327,GOOD,Garudafood Putra Putri Jaya Tb,10 Okt 2018,36.897.901.455,Utama
328,GOTO,GoTo Gojek Tokopedia Tbk.,11 Apr 2022,1.201.409.662.836,Ekonomi Baru
329,GPRA,Perdana Gapuraprima Tbk.,10 Okt 2007,4.276.655.336,Utama
330,GPSO,Geoprima Solusi Tbk.,06 Sep 2021,666.741.103,Pengembangan
331,GRIA,Ingria Pratama Capitalindo Tbk,08 Agt 2023,7.375.720.674,Pengembangan
332,GRPH,Griptha Putra Persada Tbk.,17 Jan 2024,1.000.000.000,Pengembangan
333,GRPM,Graha Prima Mentari Tbk.,10 Jul 2023,1.545.000.452,Akselerasi
334,GSMF,Equity Development Investment ,23 Okt 1989,14.230.399.705,Pengembangan
335,GTBO,Garda Tujuh Buana Tbk,09 Jul 2009,2.500.000.000,Pengembangan
336,GTRA,Grahaprima Suksesmandiri Tbk.,30 Mar 2023,1.894.375.000,Pengembangan
337,GTSI,GTS Internasional Tbk.,08 Sep 2021,15.819.142.767,Utama
338,GULA,Aman Agrindo Tbk.,03 Agt 2022,1.070.362.500,Pengembangan
339,GWSA,Greenwood Sejahtera Tbk.,23 Des 2011,7.800.760.000,Utama
340,GZCO,Gozco Plantations Tbk.,15 Mei 2008,6.000.000.000,Utama
341,HADE,Himalaya Energi Perkasa Tbk.,12 Apr 2004,2.120.000.000,Pemantauan Khusus
342,HAIS,Hasnur Internasional Shipping ,01 Sep 2021,2.626.250.000,Utama
343,HAJJ,Arsy Buana Travelindo Tbk.,05 Apr 2023,2.290.515.156,Akselerasi
344,HALO,Haloni Jane Tbk.,08 Feb 2023,5.650.008.773,Pengembangan
345,HATM,Habco Trans Maritima Tbk.,26 Jul 2022,7.000.000.000,Pengembangan
346,HBAT,Minahasa Membangun Hebat Tbk.,07 Agt 2023,1.040.740.800,Akselerasi
347,HDFA,Radana Bhaskara Finance Tbk.,10 Mei 2011,6.542.445.783,Utama
348,HDIT,Hensel Davest Indonesia Tbk.,12 Jul 2019,1.524.680.000,Pemantauan Khusus
349,HDTX,Panasia Indo Resources Tbk.,06 Jun 1990,3.601.462.800,Pemantauan Khusus
350,HEAL,Medikaloka Hermina Tbk.,16 Mei 2018,15.257.806.430,Utama
351,HELI,Jaya Trishindo Tbk.,27 Mar 2018,832.862.387,Pengembangan
352,HERO,Hero Supermarket Tbk.,21 Agt 1989,4.183.634.000,Pengembangan
353,HEXA,Hexindo Adiperkasa Tbk.,13 Feb 1995,840.000.000,Utama
354,HILL,Hillcon Tbk.,01 Mar 2023,2.948.300.000,Utama
355,HITS,Humpuss Intermoda Transportasi,15 Des 1997,7.101.084.801,Utama
356,HKMU,HK Metals Utama Tbk.,09 Okt 2018,3.221.750.000,Pemantauan Khusus
357,HMSP,H.M. Sampoerna Tbk.,15 Agt 1990,116.318.076.900,Utama
358,HOKI,Buyung Poetra Sembada Tbk.,22 Jun 2017,9.677.752.680,Utama
359,HOME,Hotel Mandarine Regency Tbk.,17 Jul 2008,22.212.194.782,Pemantauan Khusus
360,HOMI,Grand House Mulia Tbk.,10 Sep 2020,1.575.000.000,Pengembangan
361,HOPE,Harapan Duta Pertiwi Tbk.,24 Mei 2021,2.130.360.201,Pemantauan Khusus
362,HOTL,Saraswati Griya Lestari Tbk.,10 Jan 2013,3.550.001.452,Pemantauan Khusus
